{
  "schemaVersion": "burrete.molecular-snapshot.v1",
  "snapshotId": "018f48f2-2e20-7e53-976b-cf93e0897701",
  "snapshotSha256": "cccccccccccccccccccccccccccccccccccccccccccccccccccccccccccccccc",
  "frozenSource": {
    "documentFingerprintSha256": "dddddddddddddddddddddddddddddddddddddddddddddddddddddddddddddddd",
    "sourceRevision": 1,
    "recordCount": 2,
    "orderedRecordMoleculeIdentitySha256": "ffffffffffffffffffffffffffffffffffffffffffffffffffffffffffffffff"
  },
  "layout": {
    "files": [
      {
        "relativePath": "pack/data.bin",
        "sha256": "aaaaaaaaaaaaaaaaaaaaaaaaaaaaaaaaaaaaaaaaaaaaaaaaaaaaaaaaaaaaaaaa",
        "byteLength": 80,
        "mediaType": "application/octet-stream"
      },
      {
        "relativePath": "pack/molecular-records.v1.jsonl",
        "sha256": "eeeeeeeeeeeeeeeeeeeeeeeeeeeeeeeeeeeeeeeeeeeeeeeeeeeeeeeeeeeeeeee",
        "byteLength": 256,
        "mediaType": "application/vnd.burrete.molecular-records-v1+jsonl"
      }
    ],
    "arrays": [
      {
        "name": "moleculeContentHashes",
        "semantic": "molecule_content_sha256",
        "unit": null,
        "fileRelativePath": "pack/data.bin",
        "dtype": "u8",
        "shape": [
          2,
          32
        ],
        "byteOrder": "notApplicable",
        "alignment": 1,
        "byteOffset": 16,
        "byteLength": 64
      },
      {
        "name": "sourceRecordIds",
        "semantic": "source_record_id",
        "unit": null,
        "fileRelativePath": "pack/data.bin",
        "dtype": "u64",
        "shape": [
          2
        ],
        "byteOrder": "littleEndian",
        "alignment": 8,
        "byteOffset": 0,
        "byteLength": 16
      }
    ]
  },
  "createdAtMs": 8
}
